{"build_commit":"785a3055dbc5910a432b49de79ba349a2552d23b","build_config_id":"adn-build-977ac2f175ba0f69a10345ba4a13efd2","contract_tail":"adn-processor","contract_version":"3.9.2","first_invocation_digest":"baf3eafd068da6f27d22835215430dd2772e3c0d52e5d8a351f1fe2873c64607","first_invocation_path":"invocation_receipt.json","local_wasm_sha256":"0385bb42fd17a78759ace5a0c983c138cd432bbbef0e6bc3d5a6a7a0e855966f","manifest_digest":"8c5235c8c5d7437fbaff27ad7df2b703abe18424990dcb4ad71b8cfc6922d0a8","raw_registration_response_digest":"12071c2b075b3b9e7c3c4dae837a3ff91e44372e983b332cf79744a0093675de","raw_registration_response_path":"registration_response.json","registered_at":"2026-06-28T10:10:36.104Z","registration_status":"registered","remote_contract_id":459,"rustc_version":"rustc 1.96.0 (ac68faa20 2026-05-25)","schema_version":"adn-release-proof-v1","t3n_evidence_digest":"baf3eafd068da6f27d22835215430dd2772e3c0d52e5d8a351f1fe2873c64607","t3n_evidence_path":"t3n_evidence.json","tenant_did":"did:t3n:ad146e6861ac408900af7ece1f6e90976dad3a02","trusted_issuer":"b5a5808b97bdef6b053bb110be63af0deec60ed9"}
